{
  "schemaVersion": 1,
  "projectionKind": "tracked-release-projection-v1",
  "policy": {
    "id": "native-webgpu-tracked-release-v1",
    "digest": "sha256:e349900d79da27cb5570ea959707f741e03ea7e206d85a717a1129b27268f6a4"
  },
  "labId": "webgpu-bounded-water",
  "skill": "threejs-water-optics",
  "threeRevision": "0.185.1",
  "sourceClosureHash": "sha256:8daeac67b7ad4246c6b7d4440b6489ae1f93648c865e1103f1f4d62cd6ed0df1",
  "buildRevision": "sha256:ef5cf23d5b2d87a5912719371e5a2e53c8f33375909adbc15c508d0a737f3ac8",
  "sourceRelease": {
    "path": "evidence-manifest.json",
    "sha256": "sha256:786e23d9ff2c566456a1d7765fcbacebdc8c8a44a51063adf00052626f4da993",
    "byteLength": 34096,
    "promotionBindingDigest": "sha256:0b3a4e557d405cadbad38e15fc4e425e1cf894684aa8f78efaeabbe92945909e",
    "candidateBindingDigest": "sha256:f711e7ff1e878a5f933bcc0f0c01d805ab90b434fca4efb46736a3c66458589f",
    "artifactLedgerDigest": "sha256:4d4c1605b09c8b59437ba15628cb9155c2b84c38bdeeaba4886987f9ac12f19c",
    "imageLedgerDigest": "sha256:91989e0642a4ba1a4b2960476972a9216a822373d8410469e254543530ffddfd"
  },
  "sourceClosure": {
    "algorithm": "demo-registry-transitive-source-closure-v2",
    "roots": [
      "labs/runtime/aligned-readback.mjs",
      "labs/runtime/numeric-evidence.mjs",
      "labs/runtime/webgpu-device-identity.mjs",
      "labs/schema/evidence-bundle-v2.schema.json",
      "labs/schema/lab-manifest.schema.json",
      "labs/schema/physics-integration.schema.json",
      "labs/schema/runtime-graph.schema.json",
      "labs/schema/tier-visual-evidence.schema.json",
      "labs/schema/tracked-release-projection-v1.schema.json",
      "scripts/capture-lab-browser.mjs",
      "scripts/lib/checked-json-schema.mjs",
      "scripts/lib/evidence-manifest-contract.mjs",
      "scripts/lib/evidence-runtime-claims.mjs",
      "scripts/lib/evidence-v2.mjs",
      "scripts/lib/lab-registry.mjs",
      "scripts/lib/png-rgba.mjs",
      "scripts/lib/tracked-release-projection.mjs",
      "scripts/lib/vite-lab-config.mjs",
      "scripts/provider-demos.mjs",
      "threejs-water-optics/examples/webgpu-bounded-water"
    ],
    "files": [
      {
        "repositoryPath": "labs/runtime/aligned-readback.mjs",
        "sha256": "sha256:368531b396bb8f601be5ba65db468b4e15b1350448ceffad3a041fb5583c86a3",
        "byteLength": 2264
      },
      {
        "repositoryPath": "labs/runtime/numeric-evidence.mjs",
        "sha256": "sha256:e3df2828d3f2750ce6e8470d245d871378ca48e2840b2525583406a304334efe",
        "byteLength": 4444
      },
      {
        "repositoryPath": "labs/runtime/webgpu-device-identity.mjs",
        "sha256": "sha256:4bc6eb92755516473bc39b488c0bcfd419e5f23800c497bc44bbf3d07d509bfe",
        "byteLength": 4095
      },
      {
        "repositoryPath": "labs/schema/evidence-bundle-v2.schema.json",
        "sha256": "sha256:0dba6486cb835d4592d579429e9b47e122e390999bd23b019b8f91138b798eb5",
        "byteLength": 48299
      },
      {
        "repositoryPath": "labs/schema/lab-manifest.schema.json",
        "sha256": "sha256:9eab5e0ccb64fe9d98989670bd827e1275e126843f12d2d0dac5287cb72e5385",
        "byteLength": 7165
      },
      {
        "repositoryPath": "labs/schema/physics-integration.schema.json",
        "sha256": "sha256:6208f7e4c08941b9a01874baa42d1756cd1498755831101b140f9d2a0b507f21",
        "byteLength": 8020
      },
      {
        "repositoryPath": "labs/schema/runtime-graph.schema.json",
        "sha256": "sha256:298784d829d509e1cc8d314d7ee6c8644c4108bf22e24f373bba84659291f9cb",
        "byteLength": 3365
      },
      {
        "repositoryPath": "labs/schema/tier-visual-evidence.schema.json",
        "sha256": "sha256:db9625882ea589d30218a246bcdba737784cab0d0fa6a0b36acd88faa409c00f",
        "byteLength": 8955
      },
      {
        "repositoryPath": "labs/schema/tracked-release-projection-v1.schema.json",
        "sha256": "sha256:31070fbe15e47af755531fd6cd5a836612c2c91c861beb523fec3f78f8691994",
        "byteLength": 8254
      },
      {
        "repositoryPath": "scripts/capture-lab-browser.mjs",
        "sha256": "sha256:273d4602503ec53d01ed41bfe7acf5049047e61511cd8d82c62d99f49a3fc9cc",
        "byteLength": 105865
      },
      {
        "repositoryPath": "scripts/lib/checked-json-schema.mjs",
        "sha256": "sha256:4f9e86203b22f313150b3b583a6ac539c58161df5fdf1d58e4f7b2a01207494c",
        "byteLength": 9235
      },
      {
        "repositoryPath": "scripts/lib/evidence-manifest-contract.mjs",
        "sha256": "sha256:272c9470c9c2bd569475552cb56b85be2e9c59af98f0987fc632ce35274e19dc",
        "byteLength": 26401
      },
      {
        "repositoryPath": "scripts/lib/evidence-runtime-claims.mjs",
        "sha256": "sha256:a9288d3ce7e800453e220800f56b8037a483b82ad5d5cd31273ee390b63b8908",
        "byteLength": 29772
      },
      {
        "repositoryPath": "scripts/lib/evidence-v2.mjs",
        "sha256": "sha256:913d8ec379af5e7e5f3f0a2225e726508ad4040e43e5dfd7debbafb0a83d3ef6",
        "byteLength": 18122
      },
      {
        "repositoryPath": "scripts/lib/lab-registry.mjs",
        "sha256": "sha256:40a0a59d5fcc645bf90cd9f5e8dae27de367681ba122b1c487ef3a71bfbbe8f2",
        "byteLength": 42231
      },
      {
        "repositoryPath": "scripts/lib/png-rgba.mjs",
        "sha256": "sha256:d7c1b4c60bdc82b1399d966b238eb6ed2565368bc8705f23925bcec8e6efe58c",
        "byteLength": 8572
      },
      {
        "repositoryPath": "scripts/lib/tracked-release-projection.mjs",
        "sha256": "sha256:20b9e5cfa487398ed22e193860a3b357f3f1a4dd82cff6efc102ed917633cefd",
        "byteLength": 22540
      },
      {
        "repositoryPath": "scripts/lib/vite-lab-config.mjs",
        "sha256": "sha256:15e59fb83dd145a2480d1b9b5c35916a325fd2b22bbf7422f780ebd7fe6606ba",
        "byteLength": 652
      },
      {
        "repositoryPath": "scripts/provider-demos.mjs",
        "sha256": "sha256:ecffa92461884c834c548621c162c17adb4a30dfb6d35e16821f4e8b1e5706bb",
        "byteLength": 28370
      },
      {
        "repositoryPath": "threejs-water-optics/examples/webgpu-bounded-water/canonical-targets/mechanism/buoyancy-spray-and-masks/index.html",
        "sha256": "sha256:a823e4dffba75b44dde187cd12069c5b9f4baecfe448dcd2442e9db89e8b5e9f",
        "byteLength": 1243
      },
      {
        "repositoryPath": "threejs-water-optics/examples/webgpu-bounded-water/canonical-targets/mechanism/differential-caustics/index.html",
        "sha256": "sha256:9243491049ce0f103e3195cb6d675216c8b6f3d205f6be1f24660a295597b78e",
        "byteLength": 1233
      },
      {
        "repositoryPath": "threejs-water-optics/examples/webgpu-bounded-water/canonical-targets/mechanism/drops-and-object-ripples/index.html",
        "sha256": "sha256:87679baf1ebdfd54ab9fadbd70a872211dd5cfecabad423c4680d63d0c144ca3",
        "byteLength": 1239
      },
      {
        "repositoryPath": "threejs-water-optics/examples/webgpu-bounded-water/canonical-targets/mechanism/fresnel-and-tir/index.html",
        "sha256": "sha256:64fb22b278206a2ecb590161d90fb1e3d3dfa24b5bd02226c6948e56e1bcbe1a",
        "byteLength": 1243
      },
      {
        "repositoryPath": "threejs-water-optics/examples/webgpu-bounded-water/canonical-targets/mechanism/heightfield-simulation/index.html",
        "sha256": "sha256:70de4807c0a1fd4ac2507ee227221dacdf8b000d408ef0368eaf5d2edb62c83a",
        "byteLength": 1235
      },
      {
        "repositoryPath": "threejs-water-optics/examples/webgpu-bounded-water/canonical-targets/mechanism/refraction-and-absorption/index.html",
        "sha256": "sha256:23b0ddb617ae1ee4727a1be7f0519b7f12d5e8f804061a68e745050bb8b6ef22",
        "byteLength": 1241
      },
      {
        "repositoryPath": "threejs-water-optics/examples/webgpu-bounded-water/canonical-targets/tier/high/index.html",
        "sha256": "sha256:7b2a75912f45b9ae4f8477bfec901ac28602f0b9215c8e0f51858b14afc415d4",
        "byteLength": 1206
      },
      {
        "repositoryPath": "threejs-water-optics/examples/webgpu-bounded-water/canonical-targets/tier/low/index.html",
        "sha256": "sha256:96175749e0b8e5b96acfde9b8320bd3e0993dd22887132912d5acef1e29c60f4",
        "byteLength": 1204
      },
      {
        "repositoryPath": "threejs-water-optics/examples/webgpu-bounded-water/canonical-targets/tier/medium/index.html",
        "sha256": "sha256:5d6eba2989d29b3bf4d97a7b5eed63a42eca0296f21cb44b75a61864d437501f",
        "byteLength": 1210
      },
      {
        "repositoryPath": "threejs-water-optics/examples/webgpu-bounded-water/canonical-targets/tier/ultra/index.html",
        "sha256": "sha256:124811f408df818fdaf4dac1d61225e3bb11d23fa83a66d0e87de66002c6bc40",
        "byteLength": 1208
      },
      {
        "repositoryPath": "threejs-water-optics/examples/webgpu-bounded-water/capture-hook.mjs",
        "sha256": "sha256:ca82fb23f90338a5918a40c7e4733e8ba320ad1d198da71e2b6c0789940a2268",
        "byteLength": 2232
      },
      {
        "repositoryPath": "threejs-water-optics/examples/webgpu-bounded-water/capture.mjs",
        "sha256": "sha256:f8fe483236cfad70f8b479f303a9dc5fba6e1859c28c658d88d19bd518e1b4eb",
        "byteLength": 559
      },
      {
        "repositoryPath": "threejs-water-optics/examples/webgpu-bounded-water/constants.js",
        "sha256": "sha256:076ac9e8cce57a4d54ef8a61b86fb55d255c4badd764b5a5c0333d9f77528667",
        "byteLength": 23524
      },
      {
        "repositoryPath": "threejs-water-optics/examples/webgpu-bounded-water/cpu-water-height.js",
        "sha256": "sha256:d16545d082369ec29aa20788b2e788c114fdaffc554a7471b4e92c1e0f12ae8e",
        "byteLength": 6333
      },
      {
        "repositoryPath": "threejs-water-optics/examples/webgpu-bounded-water/fixed-step-oracle.js",
        "sha256": "sha256:6a7ccd2c10483c483223afffcd4877c99937156be5c66e546513dc3bb05662b3",
        "byteLength": 5953
      },
      {